{
  "schemaVersion": "3.0",
  "kind": "engineering",
  "reviewer": {
    "id": "sol-engineering-reviewer-v17",
    "name": "Sol xhigh engineering reviewer"
  },
  "authorId": "rotorbench-engineering-benchmark",
  "packetDigest": "3075f2f99bb2dff9a8391a3108d322ce71e124d30117bad57071d7da6507853f",
  "bundleDigest": "27b2bd9edd292c211f8b7666226d1e3e22ccf89dc56409606d00a7a9b67813c9",
  "status": "approved",
  "blockingIssues": [],
  "reviewedAt": "2026-07-29T15:34:17.3982051Z"
}
