{
  "schemaVersion": "3.0",
  "kind": "engineering",
  "reviewer": {
    "id": "sol-engineering-reviewer-v18",
    "name": "Sol xhigh engineering reviewer"
  },
  "authorId": "rotorbench-engineering-benchmark",
  "packetDigest": "32c169c24142a4c366569cf9d6737f985d87b20bae6363f79f649c0e5573b613",
  "bundleDigest": "9411e75e55eb29f5ef459a1c9170815a99f3d4efc63f8ce76b45bcfb423bf98c",
  "status": "approved",
  "blockingIssues": [],
  "reviewedAt": "2026-07-29T19:55:58.5663218Z"
}
