{
  "schemaVersion": "3.0",
  "kind": "engineering",
  "reviewer": {
    "id": "codex-independent-engineering-reviewer-v110",
    "name": "Codex independent Stage 0 engineering reviewer"
  },
  "authorId": "rotorbench-engineering-benchmark",
  "packetDigest": "b8622ce708f8e7464b3a1c22c11afcadc5ae9117c388ced617713b549397579f",
  "bundleDigest": "5f8081cc853a0665729885c4cfb3ac9883a8ecb7e1dff0a78c96e24f2391a053",
  "status": "approved",
  "blockingIssues": [],
  "reviewedAt": "2026-07-30T07:36:41.2485008Z"
}
